{
  "SchemaVersion": 1,
  "Id": "campaign/original/main",
  "Name": "Dungeon Escape",
  "Description": "The original Dungeon Escape adventure.",
  "ContentVersion": "1.0",
  "StartMapId": "map/original/overworld",
  "StartSpawnId": "spawn",
  "StartColumn": 30,
  "StartRow": 25,
  "OverworldMapId": "map/original/overworld",
  "MapsAssetPath": "Assets/DungeonEscape/Data/maps.json",
  "ItemsAssetPath": "Assets/DungeonEscape/Data/questitems.json",
  "QuestsAssetPath": "Assets/DungeonEscape/Data/quests.json",
  "DialogsAssetPath": "Assets/DungeonEscape/Data/dialog.json",
  "OverworldMonsterIds": [
    "monster/base/giant-centipede",
    "monster/base/goblin-archer",
    "monster/base/giant-wasp",
    "monster/base/giant-fire-beetle",
    "monster/base/minotaur",
    "monster/base/scout-archer",
    "monster/base/venomous-giant-wasp",
    "monster/base/gray-ooze",
    "monster/base/swarm-of-insects",
    "monster/base/tiger",
    "monster/base/metal-ooze",
    "monster/base/young-blue-dragon",
    "monster/base/giant-constrictor-snake",
    "monster/base/water-weird",
    "monster/base/giant-poisonous-snake",
    "monster/base/giant-shark",
    "monster/base/wyvern",
    "monster/base/ochre-jelly",
    "monster/base/aberrant-eye",
    "monster/base/kraken-spawn",
    "monster/base/phase-serpent",
    "monster/base/giant-octopus",
    "monster/base/triceratops",
    "monster/base/lesser-wyvern",
    "monster/base/poisonous-snake",
    "monster/base/giant-cobra",
    "monster/base/shadow",
    "monster/base/giant-scorpion",
    "monster/base/twig-blight",
    "monster/base/giant-eagle",
    "monster/base/troll",
    "monster/base/wyvern-matriarch",
    "monster/base/manticore",
    "monster/base/chimera",
    "monster/base/ape",
    "monster/base/baboon",
    "monster/base/brown-bear",
    "monster/base/dire-troll",
    "monster/base/giant-rat",
    "monster/base/animated-walking-stick",
    "monster/base/dire-wolf",
    "monster/base/griffon",
    "monster/base/polar-bear",
    "monster/base/saber-toothed-tiger",
    "monster/base/green-dragon-wyrmling",
    "monster/base/giant-crab",
    "monster/base/shelled-ooze",
    "monster/base/sea-ooze"
  ]
}
